{
  "run": "2026-10-09T12-30-00Z",
  "baselineTimeframe": "2026-10-01T00:00Z/2026-10-08T00:00Z",
  "scalingFactor": 0.25,
  "samplingFactor": {
    "prod": 1.0,
    "test": 1.0
  },
  "syntheticProbeCount": 1790,
  "dimensions": {
    "arrivalShape": {
      "metric": "wmape",
      "value": 0.0048,
      "tolerance": 0.2,
      "scalingFactor": 0.25,
      "alignedBins": 6,
      "pass": true
    },
    "latency": {
      "p50Rel": 0.6667,
      "p95Rel": 0.5833,
      "p99Rel": 0.875,
      "tolerances": {
        "p50Rel": 0.25,
        "p95Rel": 0.3,
        "p99Rel": 0.35
      },
      "perJourney": {
        "browse_product": {
          "p50Rel": 0.0333,
          "p95Rel": 0.0556,
          "p99Rel": 0.0667
        },
        "checkout": {
          "p50Rel": 0.6667,
          "p95Rel": 0.5833,
          "p99Rel": 0.875
        }
      },
      "pass": false
    },
    "serviceFanout": {
      "edgePresence": 1.0,
      "edgePresenceTolerance": 0.9,
      "rateRatioRange": [
        1.0,
        1.04
      ],
      "rateRatioBand": [
        0.5,
        2.0
      ],
      "missingEdges": [],
      "outOfBandEdges": [],
      "pass": true
    },
    "errorRate": {
      "deltaPp": 0.5,
      "tolerancePp": 1.0,
      "perJourney": {
        "browse_product": 0.2,
        "checkout": 0.5
      },
      "pass": true
    },
    "journeyMix": {
      "tvd": 0.26,
      "tolerance": 0.15,
      "pass": false
    }
  },
  "r5CrossCheck": {
    "metric": "dt.kubernetes.container.cpu_usage",
    "source": "dynatrace-kubernetes-monitoring",
    "plane": "infra (non-telemetry)",
    "workload": "frontend",
    "idleBaseline": 0.018,
    "duringRun": 0.19,
    "riseRatio": 10.556,
    "minRiseRatio": 2.0,
    "telemetryClaimsLoad": true,
    "reason": "infra signal corroborates telemetry load",
    "available": true,
    "pass": true
  },
  "decision": "iterate",
  "iteration": 1,
  "failedDimensions": [
    "latency",
    "journeyMix"
  ],
  "classifications": [
    {
      "dimension": "latency",
      "classification": "latency",
      "structural": false,
      "suggestedAction": "adjust think-time & pacing; confirm target not under-provisioned (parameter)"
    },
    {
      "dimension": "journeyMix",
      "classification": "mix",
      "structural": false,
      "suggestedAction": "retune per-journey pacing within \u00b110% of approved weights (parameter); beyond \u00b110% \u2192 VALIDATE"
    }
  ],
  "reason": "2 dimension(s) out of tolerance \u2014 adjust parameters and re-run SYNTHESIZE\u2192EXECUTE\u2192ANALYZE",
  "runTimeframe": "2026-10-09T12:10Z/2026-10-09T12:25Z"
}
